{
  "$schema": "https://json-schema.org/draft/2020-12/schema",
  "$id": "https://groundknowledge.org/schema/kb-v2.schema.json",
  "title": "Ground Knowledge knowledge base v2",
  "type": "object",
  "required": ["meta", "positions", "datasets", "factors", "sources", "vocab", "log"],
  "properties": {
    "meta": {
      "type": "object",
      "required": ["id", "question", "version", "schemaVersion"],
      "properties": {
        "id": {"type": "string", "minLength": 1},
        "question": {"type": "string"},
        "version": {"type": "integer", "minimum": 0},
        "schemaVersion": {"const": 2},
        "updated": {"type": "string"}
      },
      "additionalProperties": true
    },
    "positions": {"type": "array", "items": {"$ref": "#/$defs/position"}},
    "datasets": {"type": "array", "items": {"$ref": "#/$defs/dataset"}},
    "factors": {"type": "array", "items": {"$ref": "#/$defs/factor"}},
    "sources": {"type": "array", "items": {"$ref": "#/$defs/source"}},
    "vocab": {
      "type": "object",
      "required": ["evidence", "population", "funding"],
      "properties": {
        "evidence": {"type": "array", "items": {"$ref": "#/$defs/vocabTerm"}},
        "population": {"type": "array", "items": {"$ref": "#/$defs/vocabTerm"}},
        "funding": {"type": "array", "items": {"$ref": "#/$defs/vocabTerm"}}
      },
      "additionalProperties": true
    },
    "pendingReview": {"type": "array", "items": {"type": "object"}},
    "refused": {"type": "array", "items": {"type": "object"}},
    "log": {"type": "array", "items": {"type": "object"}}
  },
  "$defs": {
    "vocabTerm": {
      "type": "object", "required": ["label"],
      "properties": {"label": {"type": "string"}, "aliases": {"type": "array", "items": {"type": "string"}}},
      "additionalProperties": true
    },
    "position": {
      "type": "object", "required": ["id", "label", "hue"],
      "properties": {"id": {"type": "string"}, "label": {"type": "string"}, "hue": {"type": "string"}},
      "additionalProperties": true
    },
    "dataset": {
      "type": "object", "required": ["id", "label", "aliases"],
      "properties": {
        "id": {"type": "string"}, "label": {"type": "string"},
        "aliases": {"type": "array", "items": {"type": "string"}},
        "kind": {
          "enum": ["dataset", "experiment", "observation", "argument", "model", "document"],
          "description": "evidence-base kind; absent = dataset. argument/model/document are theoretical roots and are exempt from the empirical (non-human population) discount"
        },
        "proposition": {"type": "string", "description": "plain-language claim of an argument/model root"},
        "confirmed": {"type": "boolean", "description": "legacy; superseded by confirmation (still read)"},
        "confirmation": {
          "type": "object",
          "description": "auditable admission record for the dataset root",
          "required": ["status"],
          "properties": {
            "status": {"enum": ["confirmed", "provisional", "disputed"]},
            "method": {"enum": ["curator", "verified-edge"]},
            "by": {"type": "string"}, "source": {"type": "string"},
            "ts": {"type": "string"}, "note": {"type": "string"}
          },
          "allOf": [
            {
              "if": {"properties": {"status": {"const": "confirmed"}}, "required": ["status"]},
              "then": {"required": ["method", "ts"]}
            },
            {
              "if": {"properties": {"status": {"const": "confirmed"}, "method": {"const": "curator"}}, "required": ["status", "method"]},
              "then": {"required": ["by"]}
            },
            {
              "if": {"properties": {"status": {"const": "confirmed"}, "method": {"const": "verified-edge"}}, "required": ["status", "method"]},
              "then": {"required": ["source"]}
            }
          ],
          "additionalProperties": true
        }
      },
      "additionalProperties": true
    },
    "factor": {
      "type": "object", "required": ["id", "label", "weights", "provenance"],
      "properties": {
        "id": {"type": "string"}, "label": {"type": "string"},
        "weights": {"type": "object", "additionalProperties": {"enum": ["high", "med", "low", "n/a"]}},
        "provenance": {"type": "array", "items": {"type": "object"}}
      },
      "additionalProperties": true
    },
    "source": {
      "type": "object",
      "required": ["id", "title", "position", "evidence", "funding", "population", "restsOn", "provenance", "textDepth"],
      "properties": {
        "id": {"type": "string"}, "title": {"type": "string"}, "position": {"type": "string"},
        "evidence": {"type": "string"}, "funding": {"type": "string"},
        "fundingDetails": {"type": "array", "items": {"type": "string"}},
        "population": {"type": "string"},
        "restsOn": {
          "type": "array",
          "description": "each entry is a bare ref string, OR an edge object carrying its own dependency quote",
          "items": {
            "oneOf": [
              {"type": "string"},
              {
                "type": "object",
                "required": ["ref"],
                "properties": {
                  "ref": {"type": "string"},
                  "provenance": {
                    "type": "object",
                    "properties": {
                      "quote": {"type": "string"},
                      "verifiedQuote": {"enum": ["exact", "fuzzy", "missing"]},
                      "quoteVerification": {"$ref": "#/$defs/quoteVerification"}
                    },
                    "additionalProperties": true
                  }
                },
                "additionalProperties": true
              }
            ]
          }
        },
        "provenance": {"type": "object"},
        "textDepth": {"enum": ["full", "abstract", "partial", "unknown"]}
      },
      "additionalProperties": true
    },
    "quoteVerification": {
      "type": "object",
      "description": "deterministic audit record; only verbatim-sentence-v2 exact records with a checked-text hash are trusted",
      "required": ["method", "status", "textSha256", "textDepth"],
      "properties": {
        "method": {"const": "verbatim-sentence-v2"},
        "status": {"enum": ["exact", "fuzzy", "missing"]},
        "textSha256": {"type": ["string", "null"], "pattern": "^[0-9a-f]{64}$"},
        "quoteSha256": {"type": "string", "pattern": "^[0-9a-f]{64}$"},
        "textDepth": {"enum": ["full", "abstract", "partial", "unknown"]},
        "sourceUrl": {"type": "string"},
        "normalizedCharStart": {"type": "integer"},
        "normalizedCharEnd": {"type": "integer"},
        "normalization": {"type": "string"},
        "reason": {"type": "string"},
        "similarity": {"type": "number", "minimum": 0, "maximum": 1}
      },
      "additionalProperties": true
    }
  },
  "additionalProperties": true
}
