{
  "meta": {
    "id": "blackholes",
    "question": "Could the LHC create a black hole that destroys Earth?",
    "version": 27,
    "updated": "2026-07-12T13:54:20.702160+00:00",
    "portal": {
      "id": "c6c6ad01ec11",
      "baseVersion": 27,
      "url": "https://groundknowledge.org"
    },
    "schemaVersion": 2
  },
  "positions": [
    {
      "id": "pos_no_risk_lhc_collisions_are_safe",
      "label": "No risk — LHC collisions are safe",
      "hue": "#2E8B6F"
    },
    {
      "id": "pos_residual_concern_the_safety_argument_has_wea",
      "label": "Residual concern — the safety argument has weak or speculative links",
      "hue": "#B4502E"
    }
  ],
  "datasets": [
    {
      "id": "ds_cosmic_ray_empirical_bound_white_dwarf_neutr",
      "label": "Cosmic-ray empirical bound (white-dwarf & neutron-star survival)",
      "aliases": [],
      "confirmation": {
        "status": "confirmed",
        "method": "curator",
        "by": "Evgeniia",
        "ts": "2026-07-11T23:28:50-03:00",
        "note": "Audit metadata backfill: preserves the case's prior curator-confirmed decision; the source is a direct supporting source, not a verified dependency quote.",
        "source": "src_giddings_mangano_astrophysical_implications__2008"
      },
      "kind": "observation",
      "proposition": "Cosmic rays above LHC energies have struck the Earth, Sun, white dwarfs and neutron stars for billions of years without destroying them; if LHC collisions could make a dangerous stable object, these dense stars would already be gone — an empirical upper bound on the risk."
    },
    {
      "id": "ds_hawking_radiation_black_hole_evaporation",
      "label": "Hawking radiation (black-hole evaporation)",
      "aliases": [],
      "confirmation": {
        "status": "confirmed",
        "method": "curator",
        "by": "Evgeniia",
        "ts": "2026-07-11T23:28:50-03:00",
        "note": "Audit metadata backfill: preserves the case's prior curator-confirmed decision; the source is a direct supporting source, not a verified dependency quote.",
        "source": "src_lhc_safety_assessment_group_lsag_review_of_t_2008"
      },
      "kind": "argument",
      "proposition": "Any microscopic black hole produced would radiate away and evaporate essentially instantly via Hawking radiation, so it could never accrete."
    },
    {
      "id": "ds_strangelet_stability_calculations_rhic",
      "label": "Strangelet stability calculations (RHIC)",
      "aliases": [],
      "confirmation": {
        "status": "confirmed",
        "method": "curator",
        "by": "Evgeniia",
        "ts": "2026-07-11T23:28:50-03:00",
        "note": "Audit metadata backfill: preserves the case's prior curator-confirmed decision; the source is a direct supporting source, not a verified dependency quote.",
        "source": "src_blaizot_et_al_study_of_potentially_dangerous_2003"
      },
      "kind": "experiment"
    },
    {
      "id": "ds_argument_reliability_analysis_probability_th",
      "label": "Argument-reliability analysis (probability the safety argument itself is flawed)",
      "aliases": [],
      "confirmation": {
        "status": "confirmed",
        "method": "curator",
        "by": "Evgeniia",
        "ts": "2026-07-11T23:28:50-03:00",
        "note": "Audit metadata backfill: preserves the case's prior curator-confirmed decision; the source is a direct supporting source, not a verified dependency quote.",
        "source": "src_kent_a_critical_look_at_risk_assessments_for_2004"
      },
      "kind": "argument",
      "proposition": "The safety case is a chain of theoretical assumptions; the probability the argument as a whole is flawed is not negligible and is itself a residual risk."
    },
    {
      "id": "ds_metastable_black_hole_accretion_scenario",
      "label": "Metastable-black-hole accretion scenario",
      "aliases": [],
      "confirmation": {
        "status": "confirmed",
        "method": "curator",
        "by": "Evgeniia",
        "ts": "2026-07-11T23:28:50-03:00",
        "note": "Audit metadata backfill: preserves the case's prior curator-confirmed decision; the source is a direct supporting source, not a verified dependency quote.",
        "source": "src_plaga_on_the_potential_catastrophic_risk_fro_2008"
      },
      "kind": "argument",
      "proposition": "In some beyond-standard-model scenarios a metastable micro black hole might accrete rather than evaporate, so the no-evaporation branch is not fully excluded."
    },
    {
      "id": "arg_production_impossibility",
      "label": "Production impossibility under standard gravity",
      "aliases": [],
      "kind": "argument",
      "proposition": "LHC collision energies (~10 TeV) are ~15 orders of magnitude below the Planck scale, so black-hole production is impossible in standard 4D gravity — it requires speculative large extra dimensions.",
      "confirmation": {
        "status": "confirmed",
        "method": "curator",
        "by": "Evgeniia",
        "ts": "2026-07-11T23:28:50-03:00",
        "note": "Audit metadata backfill: preserves the case's prior curator-confirmed decision; the source is a direct supporting source, not a verified dependency quote.",
        "source": "src_koch_bleicher_st_cker_exclusion_of_black_hol_2009"
      }
    },
    {
      "id": "arg_accretion_timescale",
      "label": "Accretion-timescale safety argument",
      "aliases": [],
      "kind": "argument",
      "proposition": "Even a stable, neutral micro black hole would accrete matter far too slowly to grow dangerous within the lifetime of the Earth or the Sun.",
      "confirmation": {
        "status": "confirmed",
        "method": "curator",
        "by": "Evgeniia",
        "ts": "2026-07-11T23:28:50-03:00",
        "note": "Audit metadata backfill: preserves the case's prior curator-confirmed decision; the source is a direct supporting source, not a verified dependency quote.",
        "source": "src_giddings_mangano_astrophysical_implications__2008"
      }
    }
  ],
  "factors": [
    {
      "id": "f_reliability_of_the_cosmic_ray_safety_analogy",
      "label": "Reliability of the cosmic-ray safety analogy",
      "weights": {
        "pos_no_risk_lhc_collisions_are_safe": "high",
        "pos_residual_concern_the_safety_argument_has_wea": "med"
      },
      "rationale": "The entire empirical safety case rests on cosmic-ray-produced black holes not having already destroyed dense stars.",
      "provenance": [
        {
          "source": "src_giddings_mangano_astrophysical_implications__2008",
          "pos": "pos_no_risk_lhc_collisions_are_safe",
          "quote": "We argue that cases with such an effect at shorter times than the solar lifetime are ruled out, since in these scenarios black holes produced by cosmic rays impinging on much denser white dwarfs and neutron stars would then catalyze their decay on time scales incompatible with their known lifetimes.",
          "weight": "high",
          "verifiedQuote": "exact",
          "quoteVerification": {
            "method": "verbatim-sentence-v2",
            "status": "exact",
            "textSha256": "a9b91dc5f83b4d2b54611ab5fa3192f4779d3508ed810538ae9a61222e8affd0",
            "textDepth": "full",
            "sourceUrl": "https://journals.aps.org/prd/abstract/10.1103/PhysRevD.78.035009",
            "reason": "verbatim-single-sentence",
            "canonicalized": false,
            "quoteSha256": "205dac7d04652dc043e62ced1ef32387db158d8a76c491712c2663a981b6610f",
            "normalizedCharStart": 636,
            "normalizedCharEnd": 936,
            "normalization": "NFKC-typography-whitespace-v1"
          }
        },
        {
          "source": "src_ord_hillerbrand_sandberg_probing_the_improba_2010",
          "pos": "pos_residual_concern_the_safety_argument_has_wea",
          "quote": "If the probability estimate given by an argument is dwarfed by the chance that the argument itself is flawed, then the estimate is suspect.",
          "weight": "med",
          "verifiedQuote": "exact",
          "quoteVerification": {
            "method": "verbatim-sentence-v2",
            "status": "exact",
            "textSha256": "186d85de518ea34f78c68b358b69a984845e4a22b12c1277618cadfd9bad3c43",
            "textDepth": "abstract",
            "sourceUrl": "https://arxiv.org/abs/0810.5515",
            "reason": "verbatim-single-sentence",
            "canonicalized": false,
            "quoteSha256": "efdd6fcbfd1b1c207251c35cd70d82a1cfa528f59b564942154dae53d32a2c95",
            "normalizedCharStart": 895,
            "normalizedCharEnd": 1034,
            "normalization": "NFKC-typography-whitespace-v1"
          }
        }
      ]
    },
    {
      "id": "f_whether_hawking_radiation_is_guaranteed_blac",
      "label": "Whether Hawking radiation is guaranteed (black-hole evaporation)",
      "weights": {
        "pos_no_risk_lhc_collisions_are_safe": "high",
        "pos_residual_concern_the_safety_argument_has_wea": "high"
      },
      "rationale": "Deliberately builds a safety argument that does not depend on Hawking evaporation.",
      "provenance": [
        {
          "source": "src_giddings_mangano_astrophysical_implications__2008",
          "pos": "pos_no_risk_lhc_collisions_are_safe",
          "quote": "Even if penetration does not occur during slowdown, there is a different argument that it takes place on rapid time scales.",
          "weight": "high",
          "verifiedQuote": "exact",
          "quoteVerification": {
            "method": "verbatim-sentence-v2",
            "status": "exact",
            "textSha256": "a9b91dc5f83b4d2b54611ab5fa3192f4779d3508ed810538ae9a61222e8affd0",
            "textDepth": "full",
            "sourceUrl": "https://journals.aps.org/prd/abstract/10.1103/PhysRevD.78.035009",
            "reason": "verbatim-single-sentence",
            "canonicalized": false,